{
  "$schema": "http://json-schema.org/draft-07/schema#",
  "$id": "aegis/scam_detection.schema.json",
  "title": "Scam Detection Result (Fraud Shield -> Command Centre)",
  "description": "Output emitted by the Fraud Shield NLP classifier (Sudarsan) for a single call/message analysed. The command centre consumes this to render the scam alert card and feed the fusion LLM.",
  "type": "object",
  "required": ["schema_version", "event_id", "source", "timestamp", "verdict", "risk_score"],
  "properties": {
    "schema_version": { "type": "string", "const": "1.0" },
    "event_id": { "type": "string", "description": "Unique id for this analysed message/call." },
    "source": {
      "type": "string",
      "enum": ["sms", "call_transcript", "whatsapp", "email", "manual_demo"],
      "description": "Channel the text came from."
    },
    "timestamp": { "type": "string", "format": "date-time" },
    "raw_text": { "type": "string", "description": "The message/transcript that was analysed." },
    "verdict": {
      "type": "string",
      "enum": ["scam", "suspicious", "legit"],
      "description": "Top-level classification."
    },
    "risk_score": {
      "type": "number",
      "minimum": 0,
      "maximum": 1,
      "description": "Probability that this is a scam. 0 = safe, 1 = certain scam."
    },
    "scam_type": {
      "type": "string",
      "enum": ["digital_arrest", "phishing", "lottery", "loan", "kyc", "other", "none"],
      "description": "Fine-grained scam category when verdict != legit."
    },
    "markers": {
      "type": "array",
      "description": "Digital-arrest / scam markers detected. Powers the 'why flagged' explanation.",
      "items": {
        "type": "string",
        "enum": [
          "authority_impersonation",
          "fake_fir_or_case",
          "urgency_pressure",
          "crypto_or_giftcard_demand",
          "video_call_isolation",
          "personal_data_request",
          "suspicious_link",
          "spoofed_number"
        ]
      }
    },
    "explanation": {
      "type": "string",
      "description": "Optional plain-language reason (stretch: LLM-generated) shown in the UI."
    },
    "phone_number": { "type": ["string", "null"], "description": "Originating number if available (for graph/geo correlation)." },
    "reported_payment": {
      "type": ["object", "null"],
      "description": "Optional: what the victim reports having paid. Lets fusion trace the payment into fraud-graph collector accounts (the scam -> mule-ring money trail).",
      "required": ["amount"],
      "properties": {
        "amount": { "type": "number", "exclusiveMinimum": 0, "description": "Amount paid, in INR." },
        "method": {
          "type": "string",
          "enum": ["upi", "bank_transfer", "cash", "giftcard", "crypto", "other"],
          "description": "How the victim paid, if known."
        },
        "victim_account": { "type": ["string", "null"], "description": "Victim's account number / UPI ID / wallet address (method-dependent)." },
        "scammer_account": { "type": ["string", "null"], "description": "Scammer's account number / UPI ID / wallet address the money was sent to." },
        "victim_bank": { "type": ["string", "null"], "description": "Victim's bank name (for bank_transfer)." },
        "scammer_bank": { "type": ["string", "null"], "description": "Scammer's bank name (for bank_transfer)." },
        "victim_ifsc": { "type": ["string", "null"], "description": "Victim's IFSC code (for bank_transfer)." },
        "scammer_ifsc": { "type": ["string", "null"], "description": "Scammer's IFSC code (for bank_transfer)." },
        "transaction_id": { "type": ["string", "null"], "description": "Transaction/UTR reference number if available." },
        "giftcard_platform": { "type": ["string", "null"], "description": "Gift card platform (Amazon, Google Play, etc.)." },
        "giftcard_code": { "type": ["string", "null"], "description": "Gift card code/number shared with scammer." },
        "crypto_type": { "type": ["string", "null"], "description": "Cryptocurrency type (BTC, ETH, USDT, etc.)." },
        "cash_location": { "type": ["string", "null"], "description": "Location where cash was handed over." },
        "notes": { "type": ["string", "null"], "description": "Additional details from the victim." }
      },
      "additionalProperties": false
    },
    "location_hint": {
      "type": ["object", "null"],
      "description": "Optional origin location for the crime map.",
      "properties": {
        "district": { "type": "string" },
        "lat": { "type": "number" },
        "lon": { "type": "number" }
      }
    },
    "verification": {
      "type": ["object", "null"],
      "description": "Agentic verification of concrete entities in a flagged message (links resolved, IFSC/UPI/phone checked). Additive evidence — NEVER changes verdict/risk_score. Null when verdict is legit or verification is disabled.",
      "properties": {
        "checked": {
          "type": "array",
          "description": "One entry per entity a tool inspected.",
          "items": {
            "type": "object",
            "properties": {
              "entity": { "type": "string" },
              "entity_type": { "type": "string", "enum": ["url", "ifsc", "upi", "phone"] },
              "ok": { "type": "boolean" },
              "source": { "type": "string", "enum": ["live", "offline"] },
              "detail": { "type": "string" }
            }
          }
        },
        "findings": { "type": "array", "items": { "type": "string" }, "description": "Human-readable tool findings." },
        "synthesis": { "type": "string", "description": "Short investigator-facing summary (LLM or deterministic)." },
        "engine": { "type": "string", "enum": ["claude-agent", "offline-fallback"], "description": "Which synthesis path produced this." },
        "any_live": { "type": "boolean", "description": "Whether any tool made a live network call (vs offline heuristics)." }
      }
    }
  },
  "additionalProperties": false
}
